{
	"$schema": "http://json-schema.org/draft-07/schema#",
	"$id": "publication.schema.json",
	"title": "Publication Manifest",
	"type": "object",
	"properties": {
		"@context": {
			"$ref": "context.schema.json"
		},
		"type": {
			"type": [
				"string",
				"array"
			],
			"items": {
				"type": "string"
			},
			"uniqueItems": true
		},
		"conformsTo" : {
			"oneOf": [
				{
					"$ref": "url.schema.json"
				},
				{
					"type": "array",
					"items": {
						"$ref": "url.schema.json"
					}		
				}
			]
		},
		"id": {
			"type": "string"
		},
		"abridged": {
			"type": "boolean"
		},
		"accessMode": {
			"$ref": "strings.schema.json"
		},
		"accessModeSufficient": {
			"$ref": "item-lists.schema.json"
		},
		"accessibilityFeature": {
			"$ref": "strings.schema.json"
		},
		"accessibilityHazard": {
			"$ref": "strings.schema.json"
		},
		"accessibilitySummary": {
			"$ref": "localizable.schema.json"
		},
		"artist": {
			"$ref": "contributor.schema.json"
		},
		"author": {
			"$ref": "contributor.schema.json"
		},
		"colorist": {
			"$ref": "contributor.schema.json"
		},
		"contributor": {
			"$ref": "contributor.schema.json"
		},
		"creator": {
			"$ref": "contributor.schema.json"
		},
		"editor": {
			"$ref": "contributor.schema.json"
		},
		"illustrator": {
			"$ref": "contributor.schema.json"
		},
		"inker": {
			"$ref": "contributor.schema.json"
		},
		"letterer": {
			"$ref": "contributor.schema.json"
		},
		"penciler": {
			"$ref": "contributor.schema.json"
		},
		"publisher": {
			"$ref": "contributor.schema.json"
		},
		"readBy": {
			"$ref": "contributor.schema.json"
		},
		"translator": {
			"$ref": "contributor.schema.json"
		},
		"url": {
			"$ref": "urls.schema.json"
		},
		"duration": {
			"$ref": "duration.schema.json"
		},
		"inLanguage": {
			"$ref": "language.schema.json"
		},
		"dateModified": {
			"$ref": "date.schema.json"
		},
		"datePublished": {
			"$ref": "date.schema.json"
		},
		"name": {
			"$ref": "localizable.schema.json"
		},
		"readingOrder": {
			"$ref": "resource.categorization.schema.json"
		},
		"resources": {
			"$ref": "resource.categorization.schema.json"
		},
		"links": {
			"$ref": "resource.categorization.schema.json"
		}
	},
	"required": [
		"@context",
		"conformsTo"
	]
}
