{
    "@context": [
        "https://schema.org",
        "https://www.w3.org/ns/pub-context",
        {"language" : "en", "direction": "ltr"}
    ],
    "conformsTo": "https://example.com/publication/",
    "type": "Book",
    "url": "https://publisher.example.org/mobydick",
    "author": "Herman Melville",
    "dateModified": "2018-02-10T17:00:00Z",
    "id": "fakeid",
    "readingOrder": [
        "html/title.html"
    ],

    "resources": [
        
    ],

    "links": [
        {
            "type": "LinkedResource",
            "url": "html/supplement.html",
            "rel": [],
            "encodingFormat": "text/html"
        }
    ]
}