{
    "@context": [
        "https://schema.org",
        "https://www.w3.org/ns/pub-context",
        {"language" : "en"}
    ],
    "conformsTo": "https://example.com/publication/",
    "type": "Book",
    "url": "https://publisher.example.org/mobydick",
    "author": "Herman Melville",
    "dateModified": "2018-02-10T17:00:00Z",
    "accessMode": "text",
    "accessibilitySummary": "This is a test",
    "readingOrder": "html/title.html",

    "resources": [
        "css/mobydick.css",
        {
            "type": "LinkedResource",
            "rel": "cover",
            "url": "images/cover.jpg",
            "encodingFormat": "image/jpeg"
        },{
            "type": "LinkedResource",
            "url": "html/toc.html",
            "rel": "contents"
        },{
            "type": "LinkedResource",
            "url": "fonts/STIXGeneral.otf",
            "encodingFormat": "application/vnd.ms-opentype"
        },{
            "type": "LinkedResource",
            "url": "fonts/STIXGeneralBol.otf",
            "encodingFormat": "application/vnd.ms-opentype"
        },{
            "type": "LinkedResource",
            "url": "fonts/STIXGeneralBolIta.otf",
            "encodingFormat": "application/vnd.ms-opentype"
        },{
            "type": "LinkedResource",
            "url": "fonts/STIXGeneralItalic.otf",
            "encodingFormat": "application/vnd.ms-opentype"
        }
    ]
}