{
    "@context": [
        "https://schema.org",
        "https://www.w3.org/ns/pub-context"
    ],
    "conformsTo": "https://example.com/publication/",
    "type": "Book",
    "url": "https://publisher.example.org/mobydick",
    "author": "Herman Melville",
    "dateModified": "2018-02-10T17:00:00Z",
    "name": "The Title",
    "readingOrder": [
        "html/title.html"
    ],

    "resources": [
        "css/mobydick.css",
        {
            "type": "LinkedResource",
            "rel": "coVER",
            "url": "images/cover.jpg",
            "encodingFormat": "image/jpeg"
        },{
            "type": "LinkedResource",
            "url": "html/toc.html",
            "rel": "conTEnts",
            "encodingFormat": "text/html"
        }
    ]
}